"DESCRIPTION","DURATION IN MS","NAME","PARENT SUITE","START TIME","STATUS","STOP TIME","SUB SUITE","SUITE","TEST CLASS","TEST METHOD"
"","19240","Carga exitosa del archivo masivo y descarga de resultados","","Fri Nov 21 19:02:11 UTC 2025","broken","Fri Nov 21 19:02:30 UTC 2025","","","",""
"","19041","R30-C01 Listado de parametros de producto de renta vitalicia, reserva matematica","","Fri Nov 21 19:02:30 UTC 2025","passed","Fri Nov 21 19:02:49 UTC 2025","","","",""
"","20914","Comparacion de resultados de cotización masiva con archivo de referencia","","Fri Nov 21 19:05:24 UTC 2025","broken","Fri Nov 21 19:05:45 UTC 2025","","","",""
"","141398","R30 C02-C07 Crear y eliminar vigencias para reserva matematica adjuntando documento","","Fri Nov 21 19:02:49 UTC 2025","passed","Fri Nov 21 19:05:11 UTC 2025","","","",""
"","17008","creacion manual de cotizacion","","Fri Nov 21 19:01:54 UTC 2025","passed","Fri Nov 21 19:02:11 UTC 2025","","","",""
"","13782","Creacion de un siniestro","","Fri Nov 21 19:05:11 UTC 2025","passed","Fri Nov 21 19:05:24 UTC 2025","","","",""
