"BROKEN","EPIC","FAILED","FEATURE","PASSED","SKIPPED","STORY","UNKNOWN"
"4","","0","R30 Tablas de mortalidad","0","0","","0"
"1","","0","Validacion de resultado cotizacion masiva","0","0","","0"
"1","","0","R05 Carga masiva de cotización","0","0","","0"
"1","","0","R01 Carga masiva de cotización","0","0","","0"
"1","","0","R01- Creacion manual de cotizacion","0","0","","0"
"4","","0","R32 Notas Técnicas","0","0","","0"
"1","","0","R03 Creacion manual de cotizacion","0","0","","0"
"1","","0","Gestion de siniestros","0","0","","0"
